{
  "schema_version": 1,
  "protocol_id": "whitewater-p25-v1",
  "corpus_id": "replace-with-your-corpus-id",
  "description": "Complete P25-6 corpus metadata: frozen generated cases plus anonymous on-box production sequences.",
  "partitions": [
    {
      "id": "synthetic",
      "kind": "synthetic",
      "generator": "whitewater-synthetic-v1",
      "shots": [
        {"id": "syn-identity", "case_id": "identity", "path_pattern": "generated://identity", "first_frame": 0, "last_frame": 8, "reference_frame": 4, "width": 64, "height": 48, "pixel_aspect_ratio": 1.0, "encoding": "scene-linear", "channels": "RGB", "bit_depth": "float", "categories": ["identity"], "truth": {"kind": "analytic", "definition": "zero displacement"}},
        {"id": "syn-translation-x-positive", "case_id": "translation-x-positive", "path_pattern": "generated://translation-x-positive", "first_frame": 0, "last_frame": 8, "reference_frame": 4, "width": 65, "height": 49, "pixel_aspect_ratio": 1.0, "encoding": "scene-linear", "channels": "RGB", "bit_depth": "float", "categories": ["translation-x"], "truth": {"kind": "analytic", "definition": "+X signed translation"}},
        {"id": "syn-translation-x-negative", "case_id": "translation-x-negative", "path_pattern": "generated://translation-x-negative", "first_frame": 0, "last_frame": 8, "reference_frame": 4, "width": 65, "height": 49, "pixel_aspect_ratio": 1.0, "encoding": "scene-linear", "channels": "RGB", "bit_depth": "float", "categories": ["translation-x"], "truth": {"kind": "analytic", "definition": "-X signed translation"}},
        {"id": "syn-translation-y-positive", "case_id": "translation-y-positive", "path_pattern": "generated://translation-y-positive", "first_frame": 0, "last_frame": 8, "reference_frame": 4, "width": 65, "height": 49, "pixel_aspect_ratio": 1.0, "encoding": "scene-linear", "channels": "RGB", "bit_depth": "float", "categories": ["translation-y"], "truth": {"kind": "analytic", "definition": "+Y signed translation"}},
        {"id": "syn-translation-y-negative", "case_id": "translation-y-negative", "path_pattern": "generated://translation-y-negative", "first_frame": 0, "last_frame": 8, "reference_frame": 4, "width": 65, "height": 49, "pixel_aspect_ratio": 1.0, "encoding": "scene-linear", "channels": "RGB", "bit_depth": "float", "categories": ["translation-y"], "truth": {"kind": "analytic", "definition": "-Y signed translation"}},
        {"id": "syn-affine", "case_id": "affine", "path_pattern": "generated://affine", "first_frame": 0, "last_frame": 8, "reference_frame": 4, "width": 80, "height": 64, "pixel_aspect_ratio": 1.0, "encoding": "scene-linear", "channels": "RGB", "bit_depth": "float", "categories": ["affine-spatial"], "truth": {"kind": "analytic", "definition": "affine displacement"}},
        {"id": "syn-spatial", "case_id": "spatial", "path_pattern": "generated://spatial", "first_frame": 0, "last_frame": 8, "reference_frame": 4, "width": 80, "height": 64, "pixel_aspect_ratio": 1.0, "encoding": "scene-linear", "channels": "RGB", "bit_depth": "float", "categories": ["affine-spatial"], "truth": {"kind": "analytic", "definition": "spatially varying displacement"}},
        {"id": "syn-border", "case_id": "border", "path_pattern": "generated://border", "first_frame": 0, "last_frame": 8, "reference_frame": 4, "width": 80, "height": 64, "pixel_aspect_ratio": 1.0, "encoding": "scene-linear", "channels": "RGB", "bit_depth": "float", "categories": ["border"], "truth": {"kind": "analytic", "definition": "motion reaching image borders"}},
        {"id": "syn-occlusion-reveal", "case_id": "occlusion-reveal", "path_pattern": "generated://occlusion-reveal", "first_frame": 0, "last_frame": 8, "reference_frame": 4, "width": 96, "height": 64, "pixel_aspect_ratio": 1.0, "encoding": "scene-linear", "channels": "RGB", "bit_depth": "float", "categories": ["occlusion-reveal"], "truth": {"kind": "analytic", "definition": "occlusion and reveal mask"}},
        {"id": "syn-blur", "case_id": "blur", "path_pattern": "generated://blur", "first_frame": 0, "last_frame": 8, "reference_frame": 4, "width": 96, "height": 64, "pixel_aspect_ratio": 1.0, "encoding": "scene-linear", "channels": "RGB", "bit_depth": "float", "categories": ["blur"], "truth": {"kind": "analytic", "definition": "synthetic motion blur"}},
        {"id": "syn-noise", "case_id": "noise", "path_pattern": "generated://noise", "first_frame": 0, "last_frame": 8, "reference_frame": 4, "width": 96, "height": 64, "pixel_aspect_ratio": 1.0, "encoding": "scene-linear", "channels": "RGB", "bit_depth": "float", "categories": ["noise"], "truth": {"kind": "analytic", "definition": "fixed-seed additive noise"}},
        {"id": "syn-hdr-scene-linear", "case_id": "hdr-scene-linear", "path_pattern": "generated://hdr-scene-linear", "first_frame": 0, "last_frame": 8, "reference_frame": 4, "width": 96, "height": 64, "pixel_aspect_ratio": 1.0, "encoding": "scene-linear", "channels": "RGB", "bit_depth": "float", "categories": ["hdr-log"], "truth": {"kind": "analytic", "definition": "scene-linear high dynamic range plate"}},
        {"id": "syn-log-input", "case_id": "log-input", "path_pattern": "generated://log-input", "first_frame": 0, "last_frame": 8, "reference_frame": 4, "width": 96, "height": 64, "pixel_aspect_ratio": 1.0, "encoding": "log", "channels": "RGB", "bit_depth": "float", "categories": ["hdr-log"], "truth": {"kind": "analytic", "definition": "log-encoded input plate"}},
        {"id": "syn-odd-size", "case_id": "odd-size", "path_pattern": "generated://odd-size", "first_frame": 0, "last_frame": 8, "reference_frame": 4, "width": 67, "height": 53, "pixel_aspect_ratio": 1.0, "encoding": "scene-linear", "channels": "RGB", "bit_depth": "float", "categories": ["odd-padding"], "truth": {"kind": "analytic", "definition": "odd image extent"}},
        {"id": "syn-asymmetric-padding", "case_id": "asymmetric-padding", "path_pattern": "generated://asymmetric-padding", "first_frame": 0, "last_frame": 8, "reference_frame": 4, "width": 67, "height": 53, "pixel_aspect_ratio": 1.0, "encoding": "scene-linear", "channels": "RGB", "bit_depth": "float", "categories": ["odd-padding"], "generator_parameters": {"padding": {"left": 1, "right": 3, "top": 2, "bottom": 2}}, "truth": {"kind": "analytic", "definition": "asymmetric caller padding"}},
        {"id": "syn-par-half", "case_id": "par-0_5", "path_pattern": "generated://par-0_5", "first_frame": 0, "last_frame": 8, "reference_frame": 4, "width": 80, "height": 64, "pixel_aspect_ratio": 0.5, "encoding": "scene-linear", "channels": "RGBA", "bit_depth": "half", "categories": ["par"], "truth": {"kind": "analytic", "definition": "PAR 0.5"}},
        {"id": "syn-par-double", "case_id": "par-2", "path_pattern": "generated://par-2", "first_frame": 0, "last_frame": 8, "reference_frame": 4, "width": 80, "height": 64, "pixel_aspect_ratio": 2.0, "encoding": "scene-linear", "channels": "RGBA", "bit_depth": "half", "categories": ["par"], "truth": {"kind": "analytic", "definition": "PAR 2"}},
        {"id": "syn-chain-1", "case_id": "chain-1", "path_pattern": "generated://chain-1", "first_frame": 0, "last_frame": 16, "reference_frame": 8, "width": 96, "height": 64, "pixel_aspect_ratio": 1.0, "encoding": "scene-linear", "channels": "RGB", "bit_depth": "float", "categories": ["chain"], "chain_length": 1, "truth": {"kind": "analytic", "definition": "one-link composition"}},
        {"id": "syn-chain-2", "case_id": "chain-2", "path_pattern": "generated://chain-2", "first_frame": 0, "last_frame": 16, "reference_frame": 8, "width": 96, "height": 64, "pixel_aspect_ratio": 1.0, "encoding": "scene-linear", "channels": "RGB", "bit_depth": "float", "categories": ["chain"], "chain_length": 2, "truth": {"kind": "analytic", "definition": "two-link composition"}},
        {"id": "syn-chain-4", "case_id": "chain-4", "path_pattern": "generated://chain-4", "first_frame": 0, "last_frame": 16, "reference_frame": 8, "width": 96, "height": 64, "pixel_aspect_ratio": 1.0, "encoding": "scene-linear", "channels": "RGB", "bit_depth": "float", "categories": ["chain"], "chain_length": 4, "truth": {"kind": "analytic", "definition": "four-link composition"}},
        {"id": "syn-chain-8", "case_id": "chain-8", "path_pattern": "generated://chain-8", "first_frame": 0, "last_frame": 16, "reference_frame": 8, "width": 96, "height": 64, "pixel_aspect_ratio": 1.0, "encoding": "scene-linear", "channels": "RGB", "bit_depth": "float", "categories": ["chain"], "chain_length": 8, "truth": {"kind": "analytic", "definition": "eight-link composition"}},
        {"id": "syn-fhd-1920x1080-par1", "case_id": "fhd-1920x1080-par1", "path_pattern": "generated://fhd-1920x1080-par1", "first_frame": 0, "last_frame": 8, "reference_frame": 4, "width": 1920, "height": 1080, "pixel_aspect_ratio": 1.0, "encoding": "scene-linear", "channels": "RGB", "bit_depth": "float", "categories": ["identity"], "truth": {"kind": "analytic", "definition": "FHD PAR1 performance plate"}},
        {"id": "syn-uhd-3840x2160-par1", "case_id": "uhd-3840x2160-par1", "path_pattern": "generated://uhd-3840x2160-par1", "first_frame": 0, "last_frame": 8, "reference_frame": 4, "width": 3840, "height": 2160, "pixel_aspect_ratio": 1.0, "encoding": "scene-linear", "channels": "RGB", "bit_depth": "float", "categories": ["identity"], "truth": {"kind": "analytic", "definition": "UHD PAR1 performance plate"}}
      ]
    },
    {
      "id": "production_external",
      "kind": "production_external",
      "description": "Anonymous metadata pointing at frames retained on the air-gapped Flame box.",
      "shots": [
        {"id": "prod-motion-blur", "path_pattern": "REPLACE_WITH_ON_BOX_ABSOLUTE_PATH/motion-blur/plate.%04d.exr", "first_frame": 1001, "last_frame": 1017, "reference_frame": 1009, "width": 1920, "height": 1080, "pixel_aspect_ratio": 1.0, "encoding": "scene-linear", "channels": "RGBA", "bit_depth": "half", "categories": ["motion-blur"]},